{
  "$schema": "http://json-schema.org/draft-07/schema#",
  "title": "CleaningReport",
  "type": "object",
  "required": [
    "timestamp",
    "initial_rows",
    "final_clean_rows",
    "exact_duplicates_removed",
    "total_missing_values_imputed",
    "total_outliers_clipped",
    "transformations"
  ],
  "properties": {
    "timestamp": {
      "type": "string"
    },
    "initial_rows": {
      "type": "integer",
      "minimum": 0
    },
    "final_clean_rows": {
      "type": "integer",
      "minimum": 0
    },
    "exact_duplicates_removed": {
      "type": "integer",
      "minimum": 0
    },
    "total_rows_dropped": {
      "type": "integer",
      "minimum": 0
    },
    "total_missing_values_imputed": {
      "type": "integer",
      "minimum": 0
    },
    "total_outliers_clipped": {
      "type": "integer",
      "minimum": 0
    },
    "imputed_columns": {
      "type": "object"
    },
    "clipped_outliers": {
      "type": "object"
    },
    "transformations": {
      "type": "array"
    }
  }
}